{
  "schema": "catalog@1",
  "origin": "编译包 2.0：设备命令行由发布配置的参数角色指定，按锁定构建命令目录核对",
  "description": "执行计划的命令行参数值（subject 的 phrases）按锁定构建的 commands@1 目录核对：scope 为 all——每条命令都必须解析，解析不出是 not_member（不能静默放过）；参数个数、类型、取值范围和枚举按签名核对",
  "tier": "blocking",
  "basis": "要求项 commands_known：命令行在锁定构建的命令目录中解析，参数类型、取值范围和枚举合法",
  "item": "/item",
  "location": "/location",
  "catalog": "commands@1",
  "commands": [
    "$.phrases[*]"
  ],
  "required": true,
  "scope": "all",
  "match": {
    "unicode": "none",
    "case": "sensitive",
    "whitespace": "exact"
  }
}
